{
  "header": {
    "mapId": "logistics_park",
    "name": "物流园 Canonical V0 草稿",
    "schemaVersion": "1.0",
    "coordinateReference": {
      "geodeticDatum": "WGS84",
      "origin": {
        "longitudeDeg": 104.0668,
        "latitudeDeg": 30.5728,
        "altitudeM": 500.0
      },
      "localFrame": "enu",
      "linearUnit": "m",
      "angleUnit": "rad"
    }
  },
  "roads": [
    {
      "id": "road_entry",
      "name": "园区入口路",
      "referenceLine": [[0.0, 0.0, 0.0], [50.0, 0.0, 0.0]],
      "predecessorIds": ["road_return"],
      "successorIds": ["road_j10_main_connector", "road_j10_detour_connector"],
      "laneIds": ["lane_entry_inner", "lane_entry_outer"]
    },
    {
      "id": "road_j10_main_connector",
      "name": "J10 主路直行连接道",
      "referenceLine": [[50.0, 0.0, 0.0], [55.0, 0.0, 0.0]],
      "predecessorIds": ["road_entry"],
      "successorIds": ["road_main"],
      "laneIds": ["lane_j10_main_inner", "lane_j10_main_outer"]
    },
    {
      "id": "road_j10_detour_connector",
      "name": "J10 装卸区左转连接道",
      "referenceLine": [
        [50.0, 0.0, 0.0],
        [57.6537, 1.5224, 0.0],
        [64.1421, 5.8579, 0.0],
        [68.4776, 12.3463, 0.0],
        [70.0, 20.0, 0.0]
      ],
      "predecessorIds": ["road_entry"],
      "successorIds": ["road_detour"],
      "laneIds": ["lane_j10_detour"]
    },
    {
      "id": "road_main",
      "name": "园区主分拨路",
      "referenceLine": [[55.0, 0.0, 0.0], [165.0, 0.0, 0.0], [170.0, 0.0, 0.0]],
      "predecessorIds": ["road_j10_main_connector"],
      "successorIds": ["road_exit"],
      "laneIds": ["lane_main_inner", "lane_main_outer"]
    },
    {
      "id": "road_detour",
      "name": "装卸区绕行路",
      "referenceLine": [
        [70.0, 20.0, 0.0],
        [70.0, 50.0, 0.0],
        [78.7868, 71.2132, 0.0],
        [100.0, 80.0, 0.0],
        [120.0, 80.0, 0.0],
        [141.2132, 71.2132, 0.0],
        [150.0, 50.0, 0.0],
        [150.0, 20.0, 0.0],
        [155.8579, 5.8579, 0.0],
        [170.0, 0.0, 0.0]
      ],
      "predecessorIds": ["road_j10_detour_connector"],
      "successorIds": ["road_exit"],
      "laneIds": ["lane_detour"]
    },
    {
      "id": "road_exit",
      "name": "园区出口段",
      "referenceLine": [[170.0, 0.0, 0.0], [240.0, 0.0, 0.0]],
      "predecessorIds": ["road_main", "road_detour"],
      "successorIds": ["road_return"],
      "laneIds": ["lane_exit_inner", "lane_exit_outer"]
    },
    {
      "id": "road_return",
      "name": "南侧回程闭环",
      "referenceLine": [
        [240.0, 0.0, 0.0],
        [275.3553, -14.6447, 0.0],
        [290.0, -50.0, 0.0],
        [290.0, -130.0, 0.0],
        [275.3553, -165.3553, 0.0],
        [240.0, -180.0, 0.0],
        [0.0, -180.0, 0.0],
        [-35.3553, -165.3553, 0.0],
        [-50.0, -130.0, 0.0],
        [-50.0, -50.0, 0.0],
        [-35.3553, -14.6447, 0.0],
        [0.0, 0.0, 0.0]
      ],
      "predecessorIds": ["road_exit"],
      "successorIds": ["road_entry"],
      "laneIds": ["lane_return_inner", "lane_return_outer"]
    }
  ],
  "lanes": [
    {
      "id": "lane_entry_inner",
      "roadId": "road_entry",
      "centerline": [[0.0, -1.75, 0.0], [50.0, -1.75, 0.0]],
      "side": "right",
      "orderFromReference": 1,
      "leftBoundaryId": "boundary_entry_left",
      "rightBoundaryId": "boundary_entry_middle",
      "predecessorIds": ["lane_return_inner"],
      "successorIds": ["lane_j10_main_inner", "lane_j10_detour"],
      "direction": "along_reference_line",
      "status": "open",
      "widthM": 3.5,
      "speedLimitMps": 8.33
    },
    {
      "id": "lane_entry_outer",
      "roadId": "road_entry",
      "centerline": [[0.0, -5.25, 0.0], [50.0, -5.25, 0.0]],
      "side": "right",
      "orderFromReference": 2,
      "leftBoundaryId": "boundary_entry_middle",
      "rightBoundaryId": "boundary_entry_right",
      "predecessorIds": ["lane_return_outer"],
      "successorIds": ["lane_j10_main_outer"],
      "direction": "along_reference_line",
      "status": "open",
      "widthM": 3.5,
      "speedLimitMps": 8.33
    },
    {
      "id": "lane_j10_main_inner",
      "roadId": "road_j10_main_connector",
      "centerline": [[50.0, -1.75, 0.0], [55.0, -1.75, 0.0]],
      "side": "right",
      "orderFromReference": 1,
      "leftBoundaryId": "boundary_j10_main_left",
      "rightBoundaryId": "boundary_j10_main_middle",
      "predecessorIds": ["lane_entry_inner"],
      "successorIds": ["lane_main_inner"],
      "direction": "along_reference_line",
      "status": "open",
      "widthM": 3.5,
      "speedLimitMps": 5.56
    },
    {
      "id": "lane_j10_main_outer",
      "roadId": "road_j10_main_connector",
      "centerline": [[50.0, -5.25, 0.0], [55.0, -5.25, 0.0]],
      "side": "right",
      "orderFromReference": 2,
      "leftBoundaryId": "boundary_j10_main_middle",
      "rightBoundaryId": "boundary_j10_main_right",
      "predecessorIds": ["lane_entry_outer"],
      "successorIds": ["lane_main_outer"],
      "direction": "along_reference_line",
      "status": "open",
      "widthM": 3.5,
      "speedLimitMps": 5.56
    },
    {
      "id": "lane_j10_detour",
      "roadId": "road_j10_detour_connector",
      "centerline": [
        [50.0, -1.75, 0.0],
        [58.3235, -0.0945, 0.0],
        [65.3795, 4.6205, 0.0],
        [70.0945, 11.6765, 0.0],
        [71.75, 20.0, 0.0]
      ],
      "side": "right",
      "orderFromReference": 1,
      "leftBoundaryId": "boundary_j10_detour_left",
      "rightBoundaryId": "boundary_j10_detour_right",
      "predecessorIds": ["lane_entry_inner"],
      "successorIds": ["lane_detour"],
      "direction": "along_reference_line",
      "status": "open",
      "widthM": 3.5,
      "speedLimitMps": 5.56
    },
    {
      "id": "lane_main_inner",
      "roadId": "road_main",
      "centerline": [[55.0, -1.75, 0.0], [165.0, -1.75, 0.0], [170.0, -1.75, 0.0]],
      "side": "right",
      "orderFromReference": 1,
      "leftBoundaryId": "boundary_main_left",
      "rightBoundaryId": "boundary_main_middle",
      "predecessorIds": ["lane_j10_main_inner"],
      "successorIds": ["lane_exit_inner"],
      "direction": "along_reference_line",
      "status": "open",
      "widthM": 3.5,
      "speedLimitMps": 8.33
    },
    {
      "id": "lane_main_outer",
      "roadId": "road_main",
      "centerline": [[55.0, -5.25, 0.0], [165.0, -5.25, 0.0], [170.0, -5.25, 0.0]],
      "side": "right",
      "orderFromReference": 2,
      "leftBoundaryId": "boundary_main_middle",
      "rightBoundaryId": "boundary_main_right",
      "predecessorIds": ["lane_j10_main_outer"],
      "successorIds": ["lane_exit_outer"],
      "direction": "along_reference_line",
      "status": "open",
      "widthM": 3.5,
      "speedLimitMps": 8.33
    },
    {
      "id": "lane_detour",
      "roadId": "road_detour",
      "centerline": [
        [71.75, 20.0, 0.0],
        [71.75, 50.0, 0.0],
        [80.0242, 69.9758, 0.0],
        [100.0, 78.25, 0.0],
        [120.0, 78.25, 0.0],
        [139.9758, 69.9758, 0.0],
        [148.25, 50.0, 0.0],
        [148.25, 20.0, 0.0],
        [154.6205, 4.6205, 0.0],
        [170.0, -1.75, 0.0]
      ],
      "side": "right",
      "orderFromReference": 1,
      "leftBoundaryId": "boundary_detour_left",
      "rightBoundaryId": "boundary_detour_right",
      "predecessorIds": ["lane_j10_detour"],
      "successorIds": ["lane_exit_inner"],
      "direction": "along_reference_line",
      "status": "open",
      "widthM": 3.5,
      "speedLimitMps": 5.56
    },
    {
      "id": "lane_exit_inner",
      "roadId": "road_exit",
      "centerline": [[170.0, -1.75, 0.0], [240.0, -1.75, 0.0]],
      "side": "right",
      "orderFromReference": 1,
      "leftBoundaryId": "boundary_exit_left",
      "rightBoundaryId": "boundary_exit_middle",
      "predecessorIds": ["lane_main_inner", "lane_detour"],
      "successorIds": ["lane_return_inner"],
      "direction": "along_reference_line",
      "status": "open",
      "widthM": 3.5,
      "speedLimitMps": 8.33
    },
    {
      "id": "lane_exit_outer",
      "roadId": "road_exit",
      "centerline": [[170.0, -5.25, 0.0], [240.0, -5.25, 0.0]],
      "side": "right",
      "orderFromReference": 2,
      "leftBoundaryId": "boundary_exit_middle",
      "rightBoundaryId": "boundary_exit_right",
      "predecessorIds": ["lane_main_outer"],
      "successorIds": ["lane_return_outer"],
      "direction": "along_reference_line",
      "status": "open",
      "widthM": 3.5,
      "speedLimitMps": 8.33
    },
    {
      "id": "lane_return_inner",
      "roadId": "road_return",
      "centerline": [
        [240.0, -1.75, 0.0],
        [274.1179, -15.8821, 0.0],
        [288.25, -50.0, 0.0],
        [288.25, -130.0, 0.0],
        [274.1179, -164.1179, 0.0],
        [240.0, -178.25, 0.0],
        [0.0, -178.25, 0.0],
        [-34.1179, -164.1179, 0.0],
        [-48.25, -130.0, 0.0],
        [-48.25, -50.0, 0.0],
        [-34.1179, -15.8821, 0.0],
        [0.0, -1.75, 0.0]
      ],
      "side": "right",
      "orderFromReference": 1,
      "leftBoundaryId": "boundary_return_left",
      "rightBoundaryId": "boundary_return_middle",
      "predecessorIds": ["lane_exit_inner"],
      "successorIds": ["lane_entry_inner"],
      "direction": "along_reference_line",
      "status": "open",
      "widthM": 3.5,
      "speedLimitMps": 8.33
    },
    {
      "id": "lane_return_outer",
      "roadId": "road_return",
      "centerline": [
        [240.0, -5.25, 0.0],
        [271.643, -18.357, 0.0],
        [284.75, -50.0, 0.0],
        [284.75, -130.0, 0.0],
        [271.643, -161.643, 0.0],
        [240.0, -174.75, 0.0],
        [0.0, -174.75, 0.0],
        [-31.643, -161.643, 0.0],
        [-44.75, -130.0, 0.0],
        [-44.75, -50.0, 0.0],
        [-31.643, -18.357, 0.0],
        [0.0, -5.25, 0.0]
      ],
      "side": "right",
      "orderFromReference": 2,
      "leftBoundaryId": "boundary_return_middle",
      "rightBoundaryId": "boundary_return_right",